{
  "schemaVersion": "render-manifest/v1",
  "document": {
    "title": "私有下游项目 R1 烟测",
    "subtitle": "虚构且已脱敏的 ArtifactWeaver 集成演示",
    "generatedAt": "2026-01-01T00:00:00Z",
    "locale": "zh-Hans"
  },
  "theme": {
    "name": "default",
    "accent": "#7C3AED"
  },
  "sources": {
    "markdown": "report.md",
    "reportJson": "report.json",
    "evidenceJson": "linked_evidence.json"
  },
  "outputs": {
    "html": "report.html"
  },
  "boundaries": {
    "sourceOfTruth": [
      "report.md",
      "report.json",
      "linked_evidence.json",
      "render_manifest.json"
    ],
    "generatedView": [
      "report.html"
    ],
    "privateDataPolicy": "仅限虚构脱敏演示"
  }
}
